Aandelen	AQR Capital Management LLC - Verenigde Staten	4400375037	2017	AQR Capital Management LLC Alternative Equity - Het doel van het fonds is om een aantrekkelijk lange termijn risico/rendement-profiel te bereiken door posities in te nemen op de wereldwijde ontwikkelde aandelenmarkten gebaseerd op alternatieve aandelenstrategieën. Over een volledige economische cyclus wordt een gemiddelde volatiliteit verwacht die tenminste 10% lager ligt dan die van de benchmark en een rendement dat hoger ligt dan de benchmark. De strategie van het fonds is om door middel van systematische aandelenstrategieën in te spelen op diverse marktanomalieën.
Aandelen	BlackRock Advisors (UK) Ltd. - Verenigd Koninkrijk	15385861847	2011	BlackRock FTSE All World Index Plus - Binnen dit mandaat wordt belegd in ondernemingen in ontwikkelde markten. Het mandaat heeft als doelstelling om op langere termijn een rendement na transactiekosten te behalen dat tenminste gelijk is aan het benchmarkrendement.
Aandelen	BlackRock Advisors (UK) Ltd. - Verenigd Koninkrijk	1873634467	2016	BlackRock Emerging Markets - Het behalen van een rendement dat is gelegen boven het index-rendement door beperkt af te wijken van de benchmark, terwijl het risico binnen nauwe bandbreedtes wordt gehouden. Binnen dit mandaat wordt belegd in ondernemingen in opkomende markten, zoals China, Brazilië en Rusland.     
Aandelen	Legal & General asset management - Verenigd Koninkrijk	16599427438	2017	Legal & General asset management Alternative Equity - Binnen dit mandaat wordt belegd in ondernemingen in ontwikkelde markten. Het mandaat heeft als doelstelling om op langere termijn een rendement na transactiekosten te behalen dat tenminste gelijk is aan het benchmarkrendement.
Aandelen	PGGM Vermogensbeheer B.V. - Nederland	1864830796	2016	PGGM SDI Beursgenoteerde aandelen - SDI Beursgenoteerde aandelen is onderdeel van het bredere PFZW beleggingsbeleidsinitiatief dat een verviervoudiging van de positieve duurzaamheidsbijdrage beoogt. Bij SDI wordt door de uitvoerder hieraan invulling gegeven door een subset van bedrijven te kiezen uit het SDI universum. Het BOA universum is een door PFZW vastgesteld universum met ondernemingen die via hun producten, diensten en/of leiderschap een positieve bijdrage leveren aan oplossingen voor de door PFZW gedefinieerde duurzaamheidsthema's.
Aandelen	PGGM Vermogensbeheer B.V. - Nederland	2673594	2010	Global Equity Transition Portfolio - Mandaat ten behoeve van de transitie van het Global Equity mandaat naar het PGGM Global Equity PF Fund
Aandelen	PGGM Vermogensbeheer B.V. - Nederland	31985067403	2011	PGGM Developed Markets Equity PF Fund - Het fonds belegt in aandelen in ontwikkelde markten en streeft daarbij een aantrekkelijk langetermijn risico- en rendementsprofiel na. Het heeft als doelstelling om op langere termijn een rendement na transactiekosten te behalen dat tenminste gelijk is aan het benchmarkrendement. Het beleggingsproces kenmerkt zich door het benutten van micro-inefficiënties die zijn gedefinieerd als (potentiële) index mutaties en/of inefficiënties in FTSE (-gerelateerde) indices.
Aandelen	PGGM Vermogensbeheer B.V. - Nederland	4633123016	2011	PGGM Developed Markets Alternative Equity PF Fund - Het fonds belegt in aandelen in ontwikkelde markten en streeft daarbij een aantrekkelijk langetermijn risico- en rendementsprofiel na. Het heeft als doelstelling om op langere termijn een rendement na transactiekosten te behalen dat tenminste gelijk is aan het benchmarkrendement.  Het beleggingsproces kenmerkt zich door beleggingen in alternatieve strategieen in plaats van de marktgewogen strategie.
Aandelen	PGGM Vermogensbeheer B.V. - Nederland	6533365966	2011	PGGM Emerging Markets Equity PF Fund - Het fonds belegt in aandelen in opkomende markten en streeft daarbij een aantrekkelijk langetermijn risico- en rendementsprofiel na. Het heeft als doelstelling om op langere termijn een rendement na transactiekosten te behalen dat tenminste gelijk is aan het benchmarkrendement. Voor het kostenefficiënt repliceren van het benchmark rendement met een strikt risico budget wordt gebruik gemaakt van twee belegginsgsstrategieën. Enerzijds wordt dit ingevuld middels een passief plus strategie, waarbij gebruikt wordt gemaakt van micro inefficiënties, anderzijds middels beperkt actief beheer, waarbij gebruik wordt gemaakt van actieve bottom up aandelen selectie.
Aandelen	PGGM Vermogensbeheer B.V. - Nederland	8948234137	2016	PGGM Developed Markets Alternative Equity 2 PF Fund - Het fonds belegt in aandelen in ontwikkelde markten en streeft daarbij een aantrekkelijk langetermijn risico- en rendementsprofiel na. Het heeft als doelstelling om op langere termijn een rendement na transactiekosten te behalen dat tenminste gelijk is aan het benchmarkrendement.  Het beleggingsproces kenmerkt zich door beleggingen in alternatieve strategieen in plaats van de marktgewogen strategie.
Aandelen	Robeco Institutional Asset Management - Nederland	3978782297	2008	Robeco Equity Index Emerging Markets - Het behalen van een rendement dat is gelegen boven het index-rendement door beperkt af te wijken van de benchmark, terwijl het risico binnen nauwe bandbreedtes wordt gehouden. Binnen dit mandaat wordt belegd in ondernemingen in opkomende markten, zoals China, Brazilië en Rusland.     
Aandelen	Robeco Institutional Asset Management - Nederland	4544391037	2017	Robeco Institutional Asset Management Alternative Equity - Het doel van het fonds is om een aantrekkelijk lange termijn risico/rendement-profiel te bereiken door posities in te nemen op de wereldwijde ontwikkelde aandelenmarkten gebaseerd op alternatieve aandelenstrategieën. Over een volledige economische cyclus wordt een gemiddelde volatiliteit verwacht die tenminste 10% lager ligt dan die van de benchmark en een rendement dat hoger ligt dan de benchmark. De strategie van het fonds is om door middel van systematische aandelenstrategieën in te spelen op diverse marktanomalieën.
Aandelen	Robeco Institutional Asset Management - Nederland	664125800	2008	Robeco Equity Index India - Het behalen van een rendement dat is gelegen boven het index-rendement door beperkt af te wijken van de benchmark, terwijl het risico binnen nauwe bandbreedtes wordt gehouden. Binnen dit mandaat wordt belegd in ondernemingen in India.     
Aandelen	UBS Asset Management (Americas), Inc. - Verenigde Staten	2924532119	2015	UBS SDI Beursgenoteerde aandelen - SDI Beursgenoteerde aandelen is onderdeel van het bredere PFZW beleggingsbeleidsinitiatief dat een verviervoudiging van de positieve duurzaamheidsbijdrage beoogt. Bij SDI wordt door de uitvoerder hieraan invulling gegeven door een subset van bedrijven te kiezen uit het SDI universum. Het BOA universum is een door PFZW vastgesteld universum met ondernemingen die via hun producten, diensten en/of leiderschap een positieve bijdrage leveren aan oplossingen voor de door PFZW gedefinieerde duurzaamheidsthema's.
Beursgenoteerd vastgoed	PGGM Vermogensbeheer B.V. - Nederland	4563654313	2009	PGGM Listed Real Estate portfolio - Het beheer van een wereldwijde portefeuille van beursgenoteerde vastgoedaandelen, die wordt belegd ten opzichte van de FTSE EPRA/NAREIT Developed Index (na aftrek van belastingen), unhedged in euro
Beursgenoteerd vastgoed	State Street Global Advisors - Nederland	6515993669	2021	State Street Listed Real Estate portfolio - Dit mandaat belegt in een wereldwijd gespreide portefeuille van beursgenoteerde vastgoedaandelen.
Currency overlay	PGGM Vermogensbeheer B.V. - Nederland	-336801133		PFZW currency overlay portfolio - Het bijsturen van het valutarisico  in overeenstemming met de Strategische Benchmark
Emerging market debt local currency	Insight Inveestment - Nederland	1402630445	2019	Insight Emerging markets debt local currency - Het mandaat belegt wereldwijd in obligaties van overheden van opkomende landen (Emerging Market Debt), die genoteerd zijn in lokale valuta’s, en streeft daarbij een aantrekkelijk risico- en rendementsprofiel na. Het mandaat heeft als doelstelling om op middellangere termijn een rendement na kosten (transactiekosten, externe management fee, custody fee en depositary fee)  te behalen dat tenminste gelijk is aan het benchmarkrendement (dat gecorrigeerd is voor niet terugvorderbare bronbelastingen) 
Emerging market debt local currency	PGGM Vermogensbeheer B.V. - Nederland	2940493131	2019	PGGM Emerging Debt Local Currency Fund - Het mandaat belegt wereldwijd in obligaties van overheden van opkomende landen (Emerging Market Debt), die genoteerd zijn in lokale valuta’s, en streeft daarbij een aantrekkelijk risico- en rendementsprofiel na. Het mandaat heeft als doelstelling om op middellangere termijn een rendement na kosten (transactiekosten, externe management fee, custody fee en depositary fee)  te behalen dat tenminste gelijk is aan het benchmarkrendement (dat gecorrigeerd is voor niet terugvorderbare bronbelastingen) 
Emerging market debt local currency	PGGM Vermogensbeheer B.V. - Nederland	8403488153	2009	PGGM Emerging Debt Local Currency Fund - Het mandaat belegt wereldwijd in obligaties van overheden van opkomende landen (Emerging Market Debt), die genoteerd zijn in lokale valuta’s, en streeft daarbij een aantrekkelijk risico- en rendementsprofiel na. Het mandaat heeft als doelstelling om op middellangere termijn een rendement na kosten (transactiekosten, externe management fee, custody fee en depositary fee)  te behalen dat tenminste gelijk is aan het benchmarkrendement (dat gecorrigeerd is voor niet terugvorderbare bronbelastingen) 
Emerging market debt local currency	State Street Global Advisors - Verenigde Staten	6981112328	2016	State Street Emerging markets debt local currency - Het mandaat belegt wereldwijd in obligaties van overheden van opkomende landen (Emerging Market Debt), die genoteerd zijn in lokale valuta’s, en streeft daarbij een aantrekkelijk risico- en rendementsprofiel na. Het mandaat heeft als doelstelling om op middellangere termijn een rendement na kosten (transactiekosten, externe management fee, custody fee en depositary fee)  te behalen dat tenminste gelijk is aan het benchmarkrendement (dat gecorrigeerd is voor niet terugvorderbare bronbelastingen) 
Hedgefondsen	Bridgewater Associates, Inc. - Verenigde Staten	0-50M	2007	Bridgewater Pure Alpha Fund - Pure Alpha is een actief beleggingsfonds die posities heeft in de wereldwijde beleggingsmarkten voor  aandelen, vastrentende waarden, valuta's en grondstoffen.
Hedgefondsen	Financial Risk Management - Verenigd Koninkrijk	0-50M	2003	FRM Thames Fund - Dit is een Fund-of-Hedge-Fund-mandaat, waarin wordt belegd in een portefeuille van verschillende hedgefondsen, actief in diverse traditionele hedgefonds-strategieën.
Hedgefondsen	Grosvenor Capital Management, LP - Verenigde Staten	0-50M	2003	Grosvenor Mississippi River Fund - Dit is een Fund-of-Hedge-Fund-mandaat, waarin wordt belegd in een portefeuille van verschillende hedgefondsen, actief in diverse traditionele hedgefonds-strategieën.
Hedgefondsen	Oaktree Capital Management - Verenigde Staten	0-50M	2010	Oaktree Opportunities Fund VIII - Oaktree belegt in vermogenstitels van bedrijven die in financiële of operationele problemen verkeren. Dit mandaat valt onder de strategie 'Corporate Distressed'.
Hypotheken	Syntrus AchmeaReal Estate & Finance - Nederland	3613369340	2015	Attens Hypotheken - Het mandaat heeft als doelstelling om een gespreide portefeuille Nederlandse particuliere woninghypotheekleningen op te bouwen
Illiquide leningen en aandelenposities	Albright Capital Management, LLC - Verenigde Staten	29891893	2007	ACM Emerging Markets Multi-Strategy Fund I, LP - ACM belegt in (publieke en private) aandelen, obligaties, leningen, (derivaten op) valuta's, renteswaps en kredietderivaten in opkomende markten. Het fonds maakt gebruik van politieke analyses en lokale expertise van The Albright Stonebridge Group.
Illiquide leningen en aandelenposities	Cordiant Capital, Inc. - Canada	1109395	2007	Cordiant Emerging Loan Fund III, LP - Beleggingen in leningen aan bedrijven in opkomende markten, die zijn gestructureerd en gesyndiceerd (zogenaamde "B-Loans") door multilaterale financiële instellingen en ontwikkelingsbanken (zoals IFC, EBRD en FMO).
Illiquide leningen en aandelenposities	Cyrte Investments B.V. - Nederland	0-50M	2006	Cyrte Fund I - Cyrte belegt op basis van een zelfontwikkelde beleggingsfilosofie wereldwijd in aandelen uit de telecom-, media- en technologiesector (TMT).
Illiquide leningen en aandelenposities	PGGM Vermogensbeheer B.V. - Nederland	142130260	2016	Overige zakelijke waarden - Het mandaat voorziet in het behalen van rendement door middel van belegging in enkele zeer specifieke mandaten die bij externe vermogensbeheerders uitstaan. Deze externe mandaten hebben een eindige looptijd en worden afgezet tegen ‘absolute return’ benchmarks.
Illiquide leningen en aandelenposities	SNS Impact Investing - Nederland	0-50M	2012	ACTIAM Institutional Microfinance Fund - Het SNS Institutional Microfinance Fund investeert in lokale banken -Microfinance Institutions (MFI's)- in opkomende markten. Het fonds wordt beheerd door SNS Impact Investing.
Illiquide leningen en aandelenposities	SNS Impact Investing - Nederland	0-50M	2012	ACTIAM Institutional Microfinance Fund II - Het SNS Institutional Microfinance Fund II investeert in lokale banken -Microfinance Institutions (MFI's)- in opkomende markten. Het fonds wordt beheerd door SNS Impact Investing.
Infrastructuur	Asper Investment Management - supranationaal	0-50M	2006	Asper Renewable Power Partners, LP - Het fonds investeert in duurzame-energieprojecten en bedrijven in Europa.
Infrastructuur	DIF Management B.V. - supranationaal	0-50M	2007	Ampere Equity Fund B.V. - Het fonds investeert in duurzame-energieprojecten in Europa.
Infrastructuur 	EIF Management, LLC - Verenigde Staten	0-50M	2007	US Power Fund III - Het fonds investeert in energieprojecten en bedrijven in de USA
Infrastructuur 	EISER Infrastructure Capital Management Ltd. - supranationaal	0-50M	2006	EISER Global Infrastructure Fund  - Het fonds investeert wereldwijd in infrastructuur-projecten en bedrijven, met een regionale focus op Europa.
Infrastructuur	Everbright Macquarie Greater China Infrastructure Management Ltd. - China	100-250M	2011	Macquarie Everbright Greater China Infrastructure Fund - Het fonds investeert in infrastructuur-projecten en bedrijven in China.
Infrastructuur	Glenmont partners - supranationaal	0-250M	2013	Glenmont Clean Energy Fund Europe II - Het fonds investeert in duurzame-energieprojecten in Europa.
Infrastructuur 	Glenmont partners - supranationaal	0-50M	2009	Glenmont Clean Energy Fund - Het fonds investeert in duurzame-energieprojecten in Europa.
Infrastructuur	Macquarie Asia Infrastructure Management - supranationaal	250-500M	2014	Macquarie Asia Infrastructure Fund - Het fonds investeert in infrastructuur-projecten en bedrijven in Azie.
Infrastructuur	Macquarie Capital Funds (Europe) Ltd. - supranationaal	0-50M	2006	Macquarie European Infrastructure Fund II - Het fonds investeert in infrastructuur-projecten en bedrijven in Europa.
Infrastructuur 	Macquarie SBI Infrastructure Management Pte. Ltd. - India	0-50M	2009	Macquarie SBI Infrastructure Fund - Het fonds investeert in infrastructuur-projecten en bedrijven in India.
Infrastructuur 	Mirova - supranationaal	0-50M	2014	Mirova Core Infrastructure Fund - Het fonds investeert in infrastructuur-projecten en bedrijven in Europa met de focus op Frankrijk
Infrastructuur	NIBC Infrastructure Partners I B.V. - supranationaal	0-50M	2007	NIBC European Infrastructure Fund I - Het fonds investeert in infrastructuur-projecten en bedrijven in Europa met een focus op de Benelux en het Verenigd Koninkrijk.
Infrastructuur	PGGM Vermogensbeheer B.V. - Nederland	10000-15000M	2016	PGGM Infrastructure Fund - Het fonds heeft als doelstelling om op langere termijn een stabiele kasstroom te generen door te beleggen in infrastructuur met een aantrekkelijk rendement- en risicoprofiel. Het fonds tracht dit doel te bereiken door beleggingen in gespecialiseerde infrastructuur fondsen en directe beleggingen in infrastructuurprojecten. 
Infrastructuur	PGGM Vermogensbeheer B.V. - Nederland	250-500M	2006	Infrastructuur segregated mandaat - Het mandaat heeft als doelstelling om op langere termijn een stabiele kasstroom te generen door te beleggen in infrastructuur met een aantrekkelijk rendement- en risicoprofiel. De vermogensbeheerder tracht dit doel te bereiken door beleggingen in gespecialiseerde infrastructuur fondsen en directe beleggingen in infrastructuurprojecten. 
Insurance	Aeolus Capital Management Ltd.  - Bermuda	100-250M	2021	Spire PF Fund - Dit fonds belegt in verzekeringsgerelateerde beleggingen (Insurance Linked Investments) via private contracten met een focus op de Verenigde Staten. Dit zijn contracten die, tegen een vergoeding, het risico van één of meerdere extreme natuurlijke catastrofe(s) overnemen.
Insurance	AlphaCat Managers Ltd. - Bermuda	500-1000M	2014	AlphaCat Soteria Fund Ltd. - Dit fonds belegt in verzekeringsgerelateerde beleggingen (Insurance Linked Investments) via private contracten met een focus op de Verenigde Staten. Dit zijn contracten die, tegen een vergoeding, het risico van één of meerdere extreme natuurlijke catastrofe(s) overnemen.
Insurance	Elementum Advisors, LLC - Verenigde Staten	250-500M	2013	Theia Catastrophe Fund Ltd. - Dit fonds belegt in verzekeringsgerelateerde beleggingen (Insurance Linked Investments) via private contracten met een focus op de Verenigde Staten. Dit zijn contracten die, tegen een vergoeding, het risico overnemen van één of meerdere extreme natuurlijke catastrofe(s).
Insurance	Fermat Capital Management, LLC - Verenigde Staten	1000-2500M	2006	Managed Account: Catastrophe Bonds - Dit mandaat belegt wereldwijd in verzekeringsgerelateerde beleggingen (Insurance Linked Securities) via catastrofe obligaties. Dit zijn contracten die, tegen een vergoeding, het risico  van één of meerdere extreme natuurlijke catastrofe(s) overnemen, met name in de Verenigde Staten.
Insurance	LGT ILS Partners Ltd. - Zwitserland	0-50M	2012	LGT (Lux) Urania ILS Fund - Dit fonds belegt in verzekeringsgerelateerde beleggingen (Insurance Linked Investments) via private contracten met een focus op Europa en Japan. Dit zijn contracten die, tegen een vergoeding, het risico van één of meerdere extreme natuurlijke catastrofe(s) overnemen.
Insurance	Munich RE - Duitsland	250-500M	2016	Leo Re Ltd. - Deze verzekeringsgerelateerde belegging (Insurance Linked Investment) belegt in private contracten wereldwijd. Dit zijn contracten die, tegen een vergoeding, het risico van één of meerdere extreme natuurlijke catastrofes overnemen. 
Insurance	Nephila Capital Ltd. - Bermuda	500-1000M	2009	Tyche Catastrophe Fund Ltd. - Dit fonds belegt in verzekeringsgerelateerde beleggingen (Insurance Linked Investments) via private contracten met een focus op de Verenigde Staten. Dit zijn contracten die, tegen een vergoeding, het risico van één of meerdere extreme natuurlijke catastrofe(s) overnemen.
Insurance	New Ocean Capital Management Ltd. - Bermuda	500-1000M	2016	Daedalus I Fund Ltd. - Dit fonds belegt in verzekeringsgerelateerde beleggingen (Insurance Linked Investments) via private contracten wereldwijd. Dit zijn contracten die, tegen een vergoeding, het risico van één of meerdere extreme natuurlijke catastrofe(s) overnemen.
Insurance	Partner Reinsurance Company Ltd. - Zwitserland	100-250M	2019	Huygens - Deze verzekeringsgerelateerde belegging (Insurance Linked Investment) belegt in private contracten wereldwijd. Dit zijn contracten die, tegen een vergoeding, het risico van één of meerdere extreme natuurlijke catastrofes overnemen. 
Insurance	PGGM Vermogensbeheer B.V. - Nederland	10000-15000M	2006	Insurance - Het Insurance Linked Investments mandaat (ILI) heeft als doelstelling om over een lange termijn investeringshorizon een netto rendement te behalen gelijk aan 4% boven de risicovrije rente. Dit doel wordt bereikt door de risico’s van grote kostbare natuurrampen, bijvoorbeeld hevige orkanen en zeer zware aardbevingen, over te nemen van (her)verzekeraars. Herverzekeraars zijn bereid een relatief hoge premie te betalen om hun geconcentreerde risico’s via de kapitaalmarkt te spreiden.
Insurance	RenaissanceRe Underwriting Managers, Ltd. - Bermuda	1000-2500M	2018	Vermeer Reinsurance Ltd. - Deze verzekeringsgerelateerde belegging (Insurance Linked Investment) belegt in private contracten met een focus op de Verenigde Staten. Dit zijn contracten die, tegen een vergoeding, het risico van één of meerdere extreme natuurlijke catastrofes overnemen. 
Insurance	SCOR SE - Frankrijk	0-250M	2021	Concordia Re Ltd. - Deze verzekeringsgerelateerde belegging (Insurance Linked Investment) belegt in private contracten wereldwijd. Dit zijn contracten die, tegen een vergoeding, het risico van één of meerdere extreme natuurlijke catastrofes overnemen. 
Insurance	Swiss Reinsurance Company Ltd.  - Zwitserland	250-500M	2019	Viaduct Re Ltd. - Deze verzekeringsgerelateerde belegging (Insurance Linked Investment) belegt in private contracten met een focus op de Verenigde Staten. Dit zijn contracten die, tegen een vergoeding, het risico van één of meerdere extreme natuurlijke catastrofes overnemen. 
Insurance	Verschillende - Bermuda	0-250M	2021	Nightingale Re Ltd. - Het managed account platform Nightingale Re geeft private verzekereringsgerelateerde beleggingen (Insurance Linked Investments) uit. Dit zijn contracten die, tegen een vergoeding, het risico van één of meerdere extreme natuurlijke catastrofes overnemen. 
Liquide krediet	abrdn - Verenigd Koninkrijk	1153029121	2021	Bedrijfsobligaties en High Yield Opkomende Markten - Het mandaat heeft als doel het opbouwen en beheren van een gediversifieerd mandaat van emerging markets Investment Grade en High Yyield corporate credits om op langere termijn een rendement na kosten te behalen dat tenminste gelijk is aan het benchmark rendement.\r\n
Liquide krediet	BlackRock - Verenigde Staten	552158082	2021	Blackrock Developed Markets High Yield - Het doel van het mandaat is om jaarlijks een netto rendement te generen, dat over een kredietcyclus, minimaal 10 basispunten boven dat van de benchmark ligt door het opbouwen van een portefeuille van bedrijfsobligaties en leningen uit ontwikkelde markten met een sub investment grade rating. 
Liquide krediet	Columbia Management Investment Advisers - Verenigde Staten	936071781	2018	US High Yield - Het doel van het mandaat is om jaarlijks een netto rendement te generen, dat over een kredietcyclus, minimaal 10 basispunten boven dat van de benchmark ligt door het opbouwen van een portefeuille van bedrijfsobligaties en leningen uit ontwikkelde markten met een sub investment grade rating. 
Liquide krediet	Federated Hermes - Verenigde Staten	355020433	2021	Federated Hermes Developed Markets High Yield - Het doel van het mandaat is om jaarlijks een netto rendement te generen, dat over een kredietcyclus, minimaal 10 basispunten boven dat van de benchmark ligt door het opbouwen van een portefeuille van bedrijfsobligaties en leningen uit ontwikkelde markten met een sub investment grade rating. 
Liquide krediet	Guggenheim Investment Management, LLC - Verenigde Staten	926861107	2011	US High Yield - Het doel van het mandaat is om jaarlijks een netto rendement te generen, dat over een kredietcyclus, minimaal 10 basispunten boven dat van de benchmark ligt door het opbouwen van een portefeuille van bedrijfsobligaties en leningen uit ontwikkelde markten met een sub investment grade rating. 
Liquide krediet	Janus Henderson - Verenigd Koninkrijk	1168418474	2021	Janus Henderson Developed Markets High Yield - Het doel van het mandaat is om jaarlijks een netto rendement te generen, dat over een kredietcyclus, minimaal 10 basispunten boven dat van de benchmark ligt door het opbouwen van een portefeuille van bedrijfsobligaties en leningen uit ontwikkelde markten met een sub investment grade rating. 
Liquide krediet	Nomura Corporate Research and Asset Management Inc. - Verenigde Staten	1114272602	2017	US High Yield - Het doel van het mandaat is om jaarlijks een netto rendement te generen, dat over een kredietcyclus, minimaal 10 basispunten boven dat van de benchmark ligt door het opbouwen van een portefeuille van bedrijfsobligaties en leningen uit ontwikkelde markten met een sub investment grade rating. 
Liquide krediet	PGGM Vermogensbeheer B.V. - Nederland	3651859566	2009	PGGM High Yield Fund - Het doel van het mandaat is om jaarlijks een netto rendement te generen, dat over een kredietcyclus, minimaal 10 basispunten boven dat van de benchmark ligt door het opbouwen van een portefeuille van (minimaal twee) externe vermogensbeheerders voor het beheren van een portefeuille van bedrijfsobligaties en leningen uit ontwikkelde markten met een sub investment grade rating. 
Liquide krediet	PGGM Vermogensbeheer B.V. - Nederland	3899353290	2009	PGGM Credits Fund - Het fonds belegt in 'investment grade' bedrijfsobligaties (Credits) die zijn genoteerd in euro's of US dollars en streeft daarbij een aantrekkelijk langetermijn risico- en rendementsprofiel na. Het fonds heeft als doelstelling om op langere termijn een rendement na transactiekosten te behalen dat tenminste gelijk is aan het benchmarkrendement. Het beleggingsproces wordt gedomineerd door individuele obligatie- en sectorselectie.
